{
  "schemaVersion": "0.1",
  "profileId": "PROFILE-HOSTED-01",
  "profileKind": "hosted",
  "description": "Private hosted service for persistent access without full production scale.",
  "components": ["liaison", "project_lead", "scheduler", "worker", "state", "artifacts", "credential_broker", "telemetry"],
  "configuration": {
    "state": {"authority": "state.db", "snapshotAuthority": false, "driver": "managed_sql"},
    "security": {"allowRawSecrets": false, "verifyProvenance": true, "networkDefault": "allowlist"},
    "scheduler": {"maxConcurrency": 12},
    "telemetry": {"enabled": true},
    "recovery": {"restoreTestsRequired": true}
  }
}
